,,,,,,,,,,
,,volcus,そなたは、鏡像文字を異なる文字として記憶したようだが。,,,R,normal,,27,
,27,loxy,へぇ〜。確かに逆向きの文字があるなぁーって思ってたのよ。でも、こんな意味があったなんて！へぇー！,,,L,normal,,48,
,28,volcus,して、先程の陣を鏡像文字で書いたこれが、蘇生の門である。地より魔素を吸い上げる門である。,,,R,normal,,44,
,,volcus,過去の慣わしだが、正しい向きで記した魔法陣を「陣」、鏡像文字で記した魔法陣を「門」と表現する。,,,R,normal,,47,
,29,loxy,なんで？,,,L,normal,,4,
,30,volcus,ふむ。確かなことはわからんが、戦う者共になぞらえるのだ。,,,R,normal,,28,
,,volcus,若き時に兵師団へ入門し、戦へ出陣をする。術者向きの魔法陣は「門」、術者から外へ向かう魔法陣は「陣」である。,,,R,normal,,53,
,31,loxy,へぇー！じゃあ、起動するための詠唱は、円周に書いた文字を読んでるのかしら？,,,L,normal,,37,
,32,volcus,そうだ。円周へ記した文字、すなわち、文字を並べて意味を表した経文(きょうもん)を読み願うことで、魔法陣は起動する。,,,R,normal,,57,
,33,loxy,うーん...じゃあ、真ん中に書く記号にも意味がある？,,,L,normal,,26,
,34,volcus,当然だ。,,,R,normal,,4,
,35,loxy,どんな意味があるの？,,,L,normal,,10,
,36,volcus,ふむ。円周上に等間隔に配置された５点を結んだ対象的な星型をイメージすると良い。,,,R,normal,,39,
,,volcus,右回りにそれぞれ海から始まり、陸ができ、そこに風が吹き、植物が芽吹き、火が立ち、また水により火が消える。,,,R,normal,,52,
,,volcus,という意味を右回りに星形の頂点がもっておる。,,,R,normal,,22,
,37,loxy,う...ふぁあぁ〜...難しい...ややこしくなってきたわね...。,,,L,normal,,34,
,38,volcus,図形をかたどる５点の位置により、表現するものが変わるのだ。,,,R,normal,,29,
,38,volcus,海の位置にある頂上を少し右にずらすと、より陸に近い属性を持つこととなる。,,,R,normal,,36,
,38,volcus,中心に据える形状と、円周へ記述した経文の関係より魔法陣を通過する魔素に与える反応が変わるのだ。,,,R,normal,,47,
,,volcus,また、門の場合、経文と同様に図形も逆向きに配置せねばならぬ。,,,R,normal,,30,
,39,loxy,う...うん...,,,L,normal,,9,
,40,volcus,して、魔法陣には必ず経文及び図形の原点を設けねばならぬ。それが、「朔(ついたち)」である。,,,R,normal,,45,
,40,volcus,そなたの門にはこれが抜けていた。朔は魔法陣がどこを始点としておるかを意味し、経文の開始と図形の海の位置を表現しておる。,,,R,normal,,59,
,41,loxy,うぅ...うぅう〜...すぅー,,,L,normal,,15,
,42,volcus,また、朔には時刻を意味する役割もある。魔法陣の中心より円周へ向かい１本の線を引く。演習に到達するまで伸ばせば、日の刻。,,,R,normal,,59,
,42,volcus,その中頃で止めれば、夕の刻。短く記述すれば月の刻である。して何も記述しない場合、魔法陣はその解釈を己で行うこととなる。,,,R,normal,,59,
,42,volcus,それを新月の魔法陣という。光の強さは通過できる魔素の量を意味することが多い。,,,R,normal,,38,
,42,volcus,それと、新月の魔法陣というのは光の一切ない夜、何が起こらぬかわからぬ、という意味だそうだ。,,,R,normal,,45,
,42,volcus,そなたの門はまさにこれであった。,,,R,normal,,16,
,42,volcus,魔法陣とは多少崩れても働くものだが、朔を書き加えた結果、そなたが記述した門の解釈が変わり、,,,R,normal,,45,
,,volcus,経文の意味と中心の図形の調和が乱れ、魔法陣としての働きを失ったのだ。,,,R,normal,,34,
,43,loxy,（ほぼ寝ている）うぅ...ふぁ...すぅー...,,,,normal,背景切り替え,24,044_sleeping_face
,44,volcus,ふむ...。話すぎたか。,,,,normal,,12,
,45,loxy,すぅー...それで...わたし...すぅー...。,,,,normal,,25,
,46,volcus,ふむ...。私の寝台で寝ると良い。私は寝ずとも良い身なのでな。,,,,normal,,31,
,,volcus,ロクシーを抱っこして移動する)軽いな。うむ...（ロクシーを布団に下ろして、布団をかける）ではロクシー、良き夢を。,,,,normal,,57,
,47,loxy,ヴォルカス...,,,,normal,,8,
,2,,ーー演劇最終日直前,,,,,,9,
,4,volcus,（Ｍ）３日目の公演も終えた。ロクシーは毎日のように部屋を訪れ、話を聞き、そのまま眠るようになった。,,,L,normal,,49,
,4,volcus,この頃から、私はロクシーに特別な思いを抱くようになったのかもしれん。,,,L,normal,,34,
,5,,ーーーーー,,,,,,5,
,6,orend,おいおいおい！すんげーなぁ！,,,R,normal,場面切り替え/背景切り替え/BGM切り替え(自然の中でゆったりと),14,024_rest_rooms
,7,shandy,えぇ。こんなに伸びるなんて...,,,R,normal,,16,
,8,volcus,ふむ。,,,L,normal,,3,
,9,era,私も！今日外を歩いてたら、演劇の話をしてる人をいっぱい見かけたよ！,,,L,normal,,33,
,10,shandy,ふふふ...。がっぽり...。,,,R,smile,,15,
,11,orend,はっはっはー！シャンディ、顔にお金って書いてあるぞー！,,,R,smile,,27,
,12,shandy,っは！いけない、つい。,,,R,confuse,,11,
,13,orend,はっはっはー！イーラ！でかしたぜぇ！,,,R,normal,,18,
,14,shandy,うふふふ、イーラちゃんのおかげだものね。,,,R,normal,,20,
,15,era,え？えへへ。そんなことないよ。オレンドが言ってた。みーんな立派なんだって。,,,L,smile,,37,
,16,volcus,ほう。,,,R,normal,,3,
,17,era,私もそう思うの！オレンドもシャンディも、劇団のみんなも！,,,L,normal,,28,
,18,volcus,ふむ。,,,R,normal,,3,
,19,era,それと来てくれてる人たちもみんなで一緒に作ってるんだなぁって。,,,L,normal,,31,
,20,orend,はっはっはー！その通りだぜー！イーラ！くー！いっちょ前なこといいやがるー！(わしわしとイーラの頭を撫でる),,,R,normal,,53,
,21,era,わっわっわ！,,,L,normal,,6,
,22,shandy,そうね！イーラちゃんのいう通りだわ。,,,R,normal,,18,
,23,era,わっわ！オレンド、目が回るー！,,,L,confuse,,15,
,24,volcus,ふむ...明日は千秋楽か。,,,L,normal,,13,
,25,orend,ん？そうさ！ついに！,,,R,normal,,10,
,26,shandy,そうね。,,,R,normal,,4,
,27,era,あぁあ...せんしゅうらく？それなに？,,,L,normal,※疑問顔,19,
,28,volcus,舞台演芸の最終日を示す言葉である。,,,R,normal,,17,
,29,era,へ？なんで？なんで、せんしゅうらく？っていうの？,,,L,normal,※疑問顔,24,
,30,volcus,ふむ。いくつかあるが、演目の締めに歌われたことが元であるという。,,,R,normal,,32,
,31,era,へ...へぇ...。,,,L,normal,,10,
,32,orend,はっはっはー！ヴェルはほんとになんでも知ってるよなー！はっはっはー！,,,R,normal,,34,
,33,shandy,ほんと、感心しちゃうわー。,,,R,normal,,13,
,Old_Style,,ーー魔王城の廊下でオレンドが歩いていると、考え事をしているロクシーを見つける。,,,,,場面切り替え/背景切り替え/BGM切り替え(Old_Style),39,028_Inside_Castle
,37,orend,いやー！腹減ったなぁー！・・およ？,,,R,normal,,17,
,38,loxy,うーん。私、やっぱり女の子として魅力がないのかしら...。,,,L,normal,,29,
,39,orend,ロクシー！,,,R,normal,,5,
,40,loxy,やっぱり、動きやすい服ばっかり着てるのがいけないのかしら...。なんか、色も地味だし...。,,,L,normal,,46,
,41,orend,およよ？ロクシー！,,,R,normal,,9,
,42,loxy,でも...きゃあ、やだ恥ずかしい！なんか肌を出した服なんて着たことないし、えー！どうしたらいいのー！,,,L,normal,照れ顔,50,
,43,orend,ロォォクシィィィー！,,,R,unique,,10,
,44,loxy,わわああああああ！,,,L,confuse,,9,
,45,orend,うお！（想像以上の大声に驚く）,,,R,normal,,15,
,46,loxy,な、何よ！お、オレンドじゃない！,,,L,normal,,16,
,47,orend,はっはっはー！そうさオレンドさ。なぁに難しい顔して考えてんだよー。,,,R,normal,,33,
,48,loxy,へ？あ、あんたには関係ないわよ！,,,L,angry,,16,
,49,orend,およよ？なんだー？今日のロクシーはどうしたんだぁー？,,,R,normal,,26,
,50,loxy,じ、ジロジロ見ないで。,,,L,normal,照れ顔,11,
,51,orend,はっはっはー！ま、いいさいいさ、話したくなったらで。でよ！腹減ったからたーべいかねーかー！いつもの山盛りー！,,,R,normal,,54,
,52,loxy,い、いく！,,,L,angry,,5,
,53,orend,そうこなくちゃなー！グッドグッドー！,,,R,normal,,18,
,54,loxy,あっ、ちょ、ちょっと待って...。,,,L,normal,,17,
,55,orend,およ？,,,R,normal,,3,
,56,loxy,や、山盛りじゃないところにしない？,,,L,normal,,17,
,57,orend,なあんだーロクシー、お腹でも壊したかー！はっはっはー！,,,R,normal,,27,
,58,loxy,ち、違うわよ！,,,L,angry,,7,
,59,orend,んー？違うのか？,,,R,normal,,8,
,60,loxy,ち、違わないわよ！,,,L,normal,,9,
,61,orend,はっはっは！ひーひー、はっきりしないロクシーだなぁ！まぁ普通のやつでもいいさ。いこーぜいこーぜ！,,,R,normal,,48,
,62,loxy,う、うん。,,,L,normal,,5,
,63,orend,あーはらへったーなー！ハングリーハングリー！,,,R,normal,,22,
,64,loxy,・・・ねえ、オレンドって好きな人いるの！？,,,L,normal,,21,
,65,orend,ん？なあんでそんなこと気になるのかなぁ！まさかロクシー！俺のことが...,,,R,normal,,36,
,66,loxy,は、はあ？何言ってんの。私はヴォルカス様一筋！あぁ...ヴォルカス様ぁ、なんであなたはそんなに博識なのでしょう...,,,L,normal,,58,
,67,orend,はっはっは！それか。それだったのかー！,,,R,normal,,19,
,68,loxy,は！しまった...。,,,L,normal,,10,
,69,orend,それで...,,,R,normal,,6,
,,orend,きゃあ、やだ恥ずかしい、なんか肌を出した服なんて着たことないし、えー！どうしたらいいのー！」とか言ってたのかー！,,,R,normal,,56,
,70,loxy,あ、あんた！聞いてたのね！！,,,L,angry,,14,
,71,orend,はっはっはー！キューティーキューティー！「えー！どうしたらいいのー！」はっはっはー！,,,R,normal,,42,
,72,loxy,ちょ、ちょっと！,,,L,angry,,8,
,73,orend,ひーひー面白いロクシーだなぁ。じゃあさ！飯食ったらサラのところいこーぜー！,,,R,normal,,37,
,74,loxy,・・・へ？サラさん？,,,L,normal,,10,
,76,,ーーサラのところへいく,,,,,場面切り替え/背景切り替え,11,017_office_sara
,78,orend,サーラーー！入るぜーー！,,,R,normal,,12,
,79,sara,出ていってください。,,,L,confuse,,10,
,80,orend,はっはっはー！相変わらずグッドな歓迎だぜー！,,,R,normal,,22,
,81,sara,仕事中です。,,,L,confuse,,6,
,82,orend,お言葉に甘えて、お邪魔するぜー！,,,R,normal,,16,
,83,sara,はぁ...。なんですか？そんなに大事な話ですか？,,,L,confuse,,24,
,84,orend,大事も大事！ロクシーが相談あるってさー！,,,R,normal,,20,
,85,loxy,お、お邪魔します。,,,L,normal,,9,
,86,sara,あら、ロクシーさん。どうしたのかしら、大事な話って。,,,R,normal,,26,
,87,loxy,えっと...大したものじゃないんだけど...,,,L,normal,,22,
,88,orend,んじゃ！俺はやることがあるから、これでなー！ソーリーソーリー！,,,R,normal,,31,
,89,loxy,あ！ちょっと！お、オレンド！,,,L,angry,,14,
,90,sara,で、要件は何かしら。,,,R,normal,,10,
,91,loxy,えっと...こ、これ、サラさんに。,,,L,normal,,17,
,92,sara,何かしら。それは。,,,R,normal,,9,
,93,loxy,人族の街で売っている、お守り、っていうの。あの...ずっとね、持ち歩いてたんだけど...,,,L,normal,,44,
,94,sara,それで？,,,R,normal,,4,
,95,loxy,オレンドからサラさんが結婚して、赤ちゃんもいるって聞いたから...。,,,L,normal,,34,
,96,sara,はぁ、で、そのお守りをどうして私にくれるのかしら？,,,R,confuse,,25,
,97,loxy,え、えへへ。今日聞いたからあげるものなくってっていうのもあるんだけど。私の冒険をずっと守ってくれてたものでね。,,,L,normal,,55,
,97,loxy,きっとご利益あるから今度はサラさんを守ってくださいって、お願いしたんだ。,,,L,normal,,36,
,98,sara,・・・そうですか。ありがとうございます。,,,R,normal,,20,
,99,loxy,わ、私には！ちょっと前は一人だったけど、今は私のことを守ってくれる人が３人もいるから！もう、意味ないかなって！,,,L,normal,,55,
,100,sara,３人ですか。私も入っているんですね。,,,R,normal,,18,
,101,loxy,うふふ。そう！だから、ちょっとお古で汚いけど、受け取って！お願い！,,,L,normal,,33,
,102,sara,・・・ふふふ。なんだか、あなたとオレンドを見てると弟に妹まで増えたみたいな気がするわ。,,,R,smile,,43,
,102,sara,ありがとうロクシーさん。じゃあ、あなたの旅のお供を、頂戴するわね。,,,R,smile,,33,
,103,loxy,えへへ、うん！,,,L,normal,,7,
,104,sara,へぇ、これが人族のお守りね。で、人族の間ではこのお守りをなんて言うのかしら？そのままお守り？かしら？,,,R,normal,,50,
,105,loxy,えっと、お守りはお守りなんだけど、今回のは安産祈願(あんざんきがん)っていうの。,,,L,normal,,40,
,106,sara,へぇそうなの。そういえば、全然気にしたことがなかったけれど、人族は子供を産む時どうやって産むのかしら？,,,R,normal,,51,
,107,loxy,へ？えーっと、お腹の中に赤ちゃんができて...,,,L,normal,,23,
,108,sara,あなた達みたいな小さな体の中に、別の人間が生まれるの？,,,R,normal,,27,
,109,loxy,そ、そう！最初はほんとに小さいんだけど、段々大きくなって、最後、赤ちゃんとしてお母さんの体から出てくるのよ。,,,L,normal,,54,
,110,sara,へぇ。知らなかったわ。教えてくれてありがとう。なんだか、大変そうね。,,,R,normal,,34,
,111,loxy,そう。私はまだ結婚もしてないからわからないんだけど、生きるか、死ぬか、って時もあるらしいの！,,,L,normal,,46,
,112,sara,だから、安産祈願、なのね。,,,R,normal,,13,
,113,loxy,そう！サラさん達、魔族は違うの？,,,L,normal,,16,
,114,sara,魔族は...そうね、種族によって違うわ。,,,R,normal,,20,
,114,sara,例えば、魔素族はそのまま地面から、オレンドたち傀儡師は魔素を吸った柳(やなぎ)の木から生まれ落ちるわ。,,,R,normal,,51,
,114,sara,形状が定まらない魔族の多くは、自然から発生するように生まれる。,,,R,normal,,31,
,115,loxy,えぇ！そうなんだ！知らなかった...。,,,L,normal,,19,
,116,sara,そう。それで、私たちのような人と同じ姿をした魔族は、,,,R,normal,,26,
,116,sara,交配をしてそこで出来上がった子供の魔素が、体を持つまでの間、母の周囲に浮くようについてまわるの。,,,R,normal,,48,
,117,loxy,え！？じゃあ、今も近くにお子さんがいるの！？,,,L,normal,,22,
,118,sara,そうよ、ここに。,,,R,normal,,8,
,119,loxy,へえぇぇ！なんか、神秘的ね。,,,L,normal,,14,
,120,sara,そうかしら？それで、しばらくは母の魔素を吸って育っていくの。,,,R,normal,,30,
,120,sara,子が強すぎると、母の魔素が枯れて死ぬことがあるの。生きるか死ぬかという意味ではあなた達と同じかしら。,,,R,normal,,50,
,121,loxy,そ、そうなのね...サラさんは大丈夫なの？,,,L,normal,,21,
,122,sara,私は強いから、全然平気よ。,,,R,normal,,13,
,123,loxy,そうなんだ...！ふーん...,,,L,normal,,15,
,124,sara,もういいかしら？安産祈願だっけ？ありがとう。,,,R,normal,,22,
,125,loxy,あ！ちょ、ちょっとまって！,,,L,normal,,13,
,126,sara,何かしら？,,,R,normal,,5,
,127,loxy,サラさん、私って可愛くないのかなぁ...？,,,L,normal,,21,
,128,sara,ん...？ロクシーさんは可愛らしいと思うわよ...？ただ、いつも埃まみれですけど。,,,R,normal,,41,
,129,loxy,やっぱり！？やっぱりそうだー...,,,L,confuse,,17,
,130,sara,どうしたのかしら？,,,R,normal,,9,
,131,loxy,私ね！ヴォルカスのことが好きなの！,,,L,normal,,17,
,132,sara,ふふふ...。あら、そうですか。,,,R,smile,,16,
,133,loxy,で、ちょっとでも可愛いって思ってもらいたくて...でも格好を全然気にしてなくて。けど、私に似合う服とか持ってなくて..,,,L,normal,,59,
,134,sara,はぁ、そうですね、私たちも戦争をしているので、あまりその辺りを気にしていませんでしたが。,,,R,normal,,44,
,134,sara,確かに夜な夜な魔王様のお部屋に出入りする方が埃まみれでは、ちょっとみっともないですね。,,,R,normal,,43,
,135,loxy,う...で、でしょ...？,,,L,normal,,13,
,136,sara,以前に人族の娘から頂戴した衣装があったような気がします。一緒に見に行きましょうか。,,,R,normal,,41,
,137,loxy,へ？そ、そんなの取ってあるの？,,,L,normal,,15,
,138,sara,傀儡師などが諜報活動をするのにとってあるんです。いくつか、見栄えが良いものもあったような気がします。,,,R,normal,,50,
,138,sara,それらは諜報活動にはそぐわないので使われず、綺麗な状態で残っているかもしれません。では、行きましょう。こちらです。,,,R,normal,,57,
,140,,ーーヴェルのところへ行く,,,,,"場面切り替え/背景切り替え(ヴェルの部屋画像があれ
ばそれがいい)/BGM切り替え(冬の朝焼け)
",12,028_Inside_Castle
,142,loxy,（ドアをノックする）い...いる？,,,L,normal,ノック音,17,
,143,volcus,ロクシーか。,,,R,normal,,6,
,144,loxy,（ドアから）ね、ねぇ、入っていい？,,,L,normal,,17,
,145,volcus,ふむ...。なぜそんなところにおる。,,,R,normal,,18,
,146,loxy,（ドアから）ぎく...いや、なんか今日はそう言う気分というか...,,,L,normal,,33,
,147,volcus,・・・ほう。,,,R,normal,,6,
,148,loxy,（ドアから）う...ちょ、ちょっと！なんていうか...,,,L,normal,※照れ顔,27,
,149,volcus,ふむ。あけておいては肌寒くなる。ロクシーよ。私は窓の外を眺めているゆえ、安心して入ってくると良い。,,,R,normal,,49,
,150,loxy,・・・あ、ありがと。,,,L,normal,※照れ顔,10,
,151,volcus,してロクシーよ、今日は何を聞きに来たのだ。,,,R,normal,,21,
,152,loxy,え...えっと...,,,L,normal,※照れ顔,10,
,153,volcus,・・・,,,R,normal,,3,
,154,loxy,えーっとおおお...。,,,L,normal,※照れ顔,11,
,155,volcus,ふむ。そこにかけると良い。,,,R,normal,※照れ顔,13,
,156,loxy,あ...うん。,,,L,normal,,7,
,157,volcus,・・・私も横にかけることとしよう。,,,R,normal,※照れ顔,17,
,158,loxy,・・・ね、ねえ。,,,L,normal,,8,
,159,volcus,ん？,,,R,normal,※照れ顔,2,
,160,loxy,そのー...ヴォルカスは今日は何してたの？,,,L,normal,,21,
,161,volcus,外の様子を伺っておった。殺気立っておる。人族の侵攻が近い。,,,R,normal,,29,
,162,loxy,へ...へぇー...。,,,L,normal,,11,
,163,volcus,ギルディが現れれば、私も戦地へ赴くこととなろう。,,,R,normal,,24,
,164,loxy,そうなんだ...。,,,L,normal,,9,
,165,volcus,そうだ。ギルディは戦場の兵士を神の陣に捉える力を持っておる。私がヤツと対峙せねば魔族は更なる戦力をそがれることとなる。,,,R,normal,,59,
,166,loxy,そっか...,,,L,normal,,6,
,167,volcus,・・・すまぬな、堅苦しい話を。,,,R,normal,,15,
,168,loxy,い、いいの！いいのよ！私が話しかけたんだから...。,,,L,normal,※照れ顔,26,
,169,volcus,ふむ。,,,R,normal,,3,
,170,loxy,・・・,,,L,normal,,3,
,171,volcus,では、少し私の話をしよう。,,,R,normal,,13,
,172,loxy,う、うん...。,,,L,normal,,8,
,173,volcus,私は一人の神の騎士であった。当時は一人の騎士でしかなく、そなたと同じ人間であった。,,,R,normal,,41,
,174,loxy,そ、そうなんだ。,,,L,normal,,8,
,175,volcus,しかし、私は人の戦いに負けたのだ。結果、この世界に漂う魔素に身を落とし、そして己の信ずる神に刃を向けた。,,,R,normal,,52,
,176,loxy,うん。,,,L,normal,,3,
,177,volcus,魔に身を落とし、己の神に刃を向けて作った仲間達ですら、人の神には勝てず赤子の腕を捻るように一蹴された。,,,R,normal,,51,
,178,loxy,うん。,,,L,normal,,3,
,179,volcus,私は我を忘れ人を切り殺し、気づけば己が鬼神のようになっておった。しかし気づいたのだ。私の切り捨てた者もまた人であると。,,,R,normal,,59,
,180,loxy,・・・。,,,L,normal,,4,
,181,volcus,して、己が刃を向けた神に縋ったのだ。争いを止めるための、守る力を祈った。その力が今も私の中に残っておる...。,,,R,normal,,55,
,181,volcus,元をたどれば、人を裏切り、己が神に刃を向け、守るために授かった力で、今なお人に仇をなしている魔王である。,,,R,normal,,52,
,182,loxy,・・・,,,L,normal,,3,
,183,volcus,その魔王をまだ愛しいという人間がおったなら、私はその気持ちだけで、震えるほど救われるのだ。,,,R,normal,,45,
,184,loxy,んふっ...ふふふ。,,,L,normal,,10,
,185,volcus,ふむ。伝えてなかったが、ロクシーよ、似合っておるぞ。,,,R,normal,,26,
,186,loxy,ヴォルカス...。ね、ね、ヴォルカスはなぜ戦っているの？,,,L,normal,,28,
,187,volcus,守るためだ。昔は人を、今は魔族を。,,,R,normal,,17,
,188,loxy,そっか...かっこいいと思う。,,,L,normal,,15,
,189,volcus,・・・して、私が話すべきことは伝えた。（立とうとする）,,,R,normal,,27,
,190,loxy,あっ...ちょ、ちょっと、ヴォルカス！,,,L,normal,,19,
,191,volcus,まだ聞きたい話があるか。,,,R,normal,,12,
,192,loxy,違うの、ね、一緒に、一緒にいてくれるだけ。,,,L,normal,,21,
,193,volcus,・・・ふ、ふむ。,,,R,normal,,8,
,194,loxy,だめかな？,,,L,normal,,5,
,195,volcus,・・・,,,R,normal,,3,
,196,loxy,いつも話を聞きながら寝ちゃって、朝起きたらここで一人なの...寂しいから一緒にいてくれるだけでいいの、ね？,,,L,normal,,53,
,197,volcus,・・・,,,R,normal,,3,
,198,loxy,・・・,,,L,normal,,3,
,199,volcus,・・・,,,R,normal,,3,
,200,volcus,わかった。では、そなたの願いを聞き届けよう。,,,R,normal,,22,
,201,loxy,ふふ！ありがと。じゃーこっち。（布団の方に座って）,,,L,smile,,25,
,202,volcus,・・・うむ。,,,R,normal,,6,
,203,loxy,ほら、ヴォルカスもたまには布団に入らなきゃ。,,,L,normal,,22,
,204,volcus,・・・ふむ。,,,R,normal,,6,
,205,loxy,ふふふ、ね、ちょっと緊張してるの？,,,L,normal,,17,
,206,volcus,・・・そうだ...そなたは緊張しておらぬのか。,,,R,normal,,23,
,207,loxy,すごい緊張してる。ふふふ。寝れるかわからない。,,,L,normal,,23,
,208,volcus,ふっ...そうか。,,,R,normal,,9,
,209,loxy,うん...ふふふ。,,,L,normal,,9,
,211,,ーー魔王城の会議室,,,,,"場面切り替え/BGM切り替え(ブルーシャドウ)//背景切り替え
(会議室っぽいのがあれば）",9,017_office_sara
,213,sara,いいえ、それは関係ありません。確かに、数度の大敗を我が軍は受けていますが、それは人族の女性が原因ではありません...。,,,L,confuse,,59,
,213,sara,違います！ヴォルカス様は常に私たち魔族のことを思い、何時も戦線の先頭に立っておられます！,,,L,confuse,,44,
,213,sara,そのお姿を見てはいないのですか！？...あ、ちょっと！今退席されては困ります！,,,L,confuse,,39,
,213,sara,...だから、それは...関係ないと何度も申したはずですが！...あなた達ねぇ！,,,L,confuse,,40,
,213,sara,ギルディがいる戦いをヴォルカス様なしで勝てると思っているんですか？だから...。はぁ、ここで頭を下げれば良いんですね。,,,L,confuse,,59,
,213,sara,わかりました...。本当に申し訳ございません。ヴォルカス様に変わってお詫び申し上げます。,,,L,confuse,,44,